spam,Leave it wif me lar... Ü wan to carry meh so heavy... Is da num 98321561 familiar to ü?
spam,Yeah we do totes. When u wanna?
spam,"Nah it's straight, if you can just bring bud or drinks or something that's actually a little more useful than straight cash"
spam,Just checking in on you. Really do miss seeing Jeremiah. Do have a great month
spam,Wrong phone! This phone! I answer this one but assume the other is people i don't well
spam,"UpgrdCentre Orange customer, you may now claim your FREE CAMERA PHONE upgrade for your loyalty. Call now on 0207 153 9153. Offer ends 26th July. T&C's apply. Opt-out available"
spam,Ya i knw u vl giv..its ok thanks kano..anyway enjoy wit ur family wit 1st salary..:-);-)
spam,"Dear Voucher Holder, To claim this weeks offer, at your PC please go to http://www.wtlp.co.uk/text. Ts&Cs apply."
spam,Want a new Video Phone? 750 anytime any network mins? Half price line rental free text for 3 months? Reply or call 08000930705 for free delivery
spam,PICK UR FONE UP NOW U DUMB?
spam,URGENT! We are trying to contact U. Todays draw shows that you have won a £800 prize GUARANTEED. Call 09050001808 from land line. Claim M95. Valid12hrs only
spam,"Hello. Sort of out in town already. That . So dont rush home, I am eating nachos. Will let you know eta."
spam,Forgot to tell ü smth.. Can ü like number the sections so that it's clearer..
spam,"That's what I love to hear :V see you sundayish, then"
spam,Had your mobile 11mths ? Update for FREE to Oranges latest colour camera mobiles & unlimited weekend calls. Call Mobile Upd8 on freefone 08000839402 or 2StopTxt
spam,Lol now I'm after that hot air balloon!
spam,Last chance 2 claim ur £150 worth of discount vouchers-Text YES to 85023 now!SavaMob-member offers mobile T Cs 08717898035. £3.00 Sub. 16 . Remove txt X or STOP
spam,SERIOUSLY. TELL HER THOSE EXACT WORDS RIGHT NOW.
spam,Have you emigrated or something? Ok maybe 5.30 was a bit hopeful...
spam,Jokin only lar... :-) depends on which phone my father can get lor...
spam,FREE entry into our £250 weekly comp just send the word WIN to 80086 NOW. 18 T&C www.txttowin.co.uk
spam,Wat u doing there?
spam,U have a Secret Admirer who is looking 2 make contact with U-find out who they R*reveal who thinks UR so special-call on 09065171142-stopsms-08718727870150ppm
spam,Aiyah u did ok already lar. E nydc at wheellock?
spam,Are your freezing ? Are you home yet ? Will you remember to kiss your mom in the morning? Do you love me ? Do you think of me ? Are you missing me yet ?
spam,Tell them no need to investigate about me anywhere.
spam,"whatever, im pretty pissed off."
spam,Dear Voucher holder Have your next meal on us. Use the following link on your pc 2 enjoy a 2 4 1 dining experiencehttp://www.vouch4me.com/etlp/dining.asp
spam,Unfortunately i've just found out that we have to pick my sister up from the airport that evening so don't think i'll be going out at all. We should try to go out one of th
spam,Hey you gave them your photo when you registered for driving ah? Tmr wanna meet at yck? 
spam,So ü pay first lar... Then when is da stock comin...
spam,How long does it take to get it.
spam,"Best msg: It's hard to be with a person, when u know that one more step foward will make u fall in love.. &amp; One step back can ruin ur friendship.. good night:-) ..."
spam,"You are a £1000 winner or Guaranteed Caller Prize, this is our Final attempt to contact you! To Claim Call 09071517866 Now! 150ppmPOBox10183BhamB64XE"
spam,I dunno until when... Lets go learn pilates...
spam,I am not having her number sir
spam,Yes..he is really great..bhaji told kallis best cricketer after sachin in world:).very tough to get out.
spam,Ok i msg u b4 i leave my house.
spam,At home watching tv lor.
spam,NO GIFTS!! You trying to get me to throw myself off a cliff or something?
spam,Ü log off 4 wat. It's sdryb8i
spam,"Xmas Offer! Latest Motorola, SonyEricsson & Nokia & FREE Bluetooth or DVD! Double Mins & 1000 Txt on Orange. Call MobileUpd8 on 08000839402 or call2optout/4QF2"
spam,I'm in school now n i'll be in da lab doing some stuff give me a call when ü r done.
spam,Wot u up 2? Thout u were gonna call me!! Txt bak luv K
spam,That's my honeymoon outfit. :)
spam,Its a part of checking IQ
spam,"Tonight? Yeah, I'd be down for that"
spam,Thanks. It was only from tescos but quite nice. All gone now. Speak soon 
spam,"Hottest pics straight to your phone!! See me getting Wet and Wanting, just for you xx Text PICS to 89555 now! txt costs 150p textoperator g696ga 18 XxX"
spam,We are okay. Going to sleep now. Later
spam,"Oh, i will get paid. The most outstanding one is for a commercial i did for Hasbro...in AUGUST! They made us jump through so many hoops to get paid. Still not."
spam,Thanks chikku..:-) gud nyt:-*
spam,Just do what ever is easier for you
spam,Gud ni8 dear..slp well..take care..swt dreams..Muah..
spam,"Also sir, i sent you an email about how to log into the usc payment portal. I.ll send you another message that should explain how things are back home. Have a great weekend."
spam,"that would be good … I'll phone you tomo lunchtime, shall I, to organise something?"
spam,What not under standing.
spam,Don't forget who owns you and who's private property you are ... And be my good boy always .. *passionate kiss*
spam,Wif my family booking tour package.
spam,"Sorry, I'll call you  later. I am in meeting sir."
spam,"Wishing you and your family Merry ""X"" mas and HAPPY NEW Year in advance.."
spam,I will come tomorrow di
spam,"Fantasy Football is back on your TV. Go to Sky Gamestar on Sky Active and play £250k Dream Team. Scoring starts on Saturday, so register now!SKY OPT OUT to 88088"
spam,"I'm in a meeting, call me later at"
spam,Yup i've finished c ü there...
spam,No need lar i go engin? Cos my sis at arts today...
spam,Becoz its  &lt;#&gt;  jan whn al the post ofice is in holiday so she cn go fr the post ofice...got it duffer
spam,When ü login dat time... Dad fetching ü home now?
spam,"Probably not, still going over some stuff here"
spam,Ha ha - had popped down to the loo when you hello-ed me. Hello!
spam,Printer is cool. I mean groovy. Wine is groovying
spam,Life spend with someone for a lifetime may be meaningless but a few moments spent with someone who really love you means more than life itself..
spam,Love it! The girls at the office may wonder why you are smiling but sore...
spam,"Oh yes, why is it like torture watching england?"
spam,"URGENT!: Your Mobile No. was awarded a £2,000 Bonus Caller Prize on 02/09/03! This is our 2nd attempt to contact YOU! Call 0871-872-9755 BOX95QU"
spam,You are a winner U have been specially selected 2 receive £1000 or a 4* holiday (flights inc) speak to a live operator 2 claim 0871277810910p/min (18+) 
spam,Love it! Daddy will make you scream with pleasure! I am going to slap your ass with my dick!
spam,Thnx dude. u guys out 2nite?
spam,:-( sad puppy noise
spam,DO NOT B LATE LOVE MUM
spam,"Aight, I'll hit you up when I get some cash"
spam,Hmm...Bad news...Hype park plaza $700 studio taken...Only left 2 bedrm-$900...
spam,"Living is very simple.. Loving is also simple.. Laughing is too simple.. Winning is tooo simple.. But, being 'SIMPLE' is very difficult.. Gud nte.:-"
spam,Eh u send wrongly lar...
spam,Lol ... I really need to remember to eat when I'm drinking but I do appreciate you keeping me company that night babe *smiles*
spam,I have many dependents
spam,Msgs r not time pass.They silently say that I am thinking of U right now and also making U think of me at least 4 a moment. Gd nt.swt drms @Shesil
spam,Idea will soon get converted to live:)
spam,Aft i finish my lunch then i go str down lor. Ard 3 smth lor. U finish ur lunch already?
spam,Thank you princess! I want to see your nice juicy booty...
spam,Jamster! To get your free wallpaper text HEART to 88888 now! T&C apply. 16 only. Need Help? Call 08701213186.
spam,You said not now. No problem. When you can. Let me know.
spam,Ok i vl..do u know i got adsense approved..
spam,Yup... I havent been there before... You want to go for the yoga? I can call up to book 
spam,Please call our customer service representative on 0800 169 6031 between 10am-9pm as you have WON a guaranteed £1000 cash or £5000 prize!
spam,And whenever you and i see we can still hook up too.
spam,I wil be there with in  &lt;#&gt;  minutes. Got any space
spam,I‘ll have a look at the frying pan in case it‘s cheap or a book perhaps. No that‘s silly a frying pan isn‘t likely to be a book
spam,88066 FROM 88066 LOST 3POUND HELP
spam,You have 1 new voicemail. Please call 08719181513.
spam,"Text me when you get off, don't call, my phones having problems"
spam,Stupid.its not possible
spam,I think steyn surely get one wicket:)